name,city,telephone,cusine,cost_for_two,address,famous_food,longitude,latitude
The Roll Xpress,Delhi NCR,+91 9910871101 +91 9821985771,"Fast Food, Chinese, Rolls, Momos",300,"494, Ganesh Nagar 2, Near Ambedkar College, Madhuban Road Shakarpur, New Delhi",,77.28605,28.62951
Bang Bang Cafe,Delhi NCR,+91 8826376400,"Fast Food, Beverages",200,"LCB 4, Janak Place, District Center",,77.08095755,28.63016686
Sukoon - The Cafe,Delhi NCR,+91 9711296196 +91 9650462100,"Cafe, Fast Food",500,"2nd Floor, Crown Interiorz Mall, Sector 35, Faridabad, Delhi","Tea , Masala Chai , Coffee , Maggi , Burgers , White Sauce Pasta , Pink Sauce Pasta",77.30744328,28.46931643
1Tablespoon Italian Ice Cream,Mumbai,+91 9820233441 022 24033441,"Desserts, Ice Cream",200,"23 Ram Villa, Road 1A, Opposite Sahakari Bhandar, King Circle, Matunga East, Mumbai",,72.85786305,19.02754017
Banter,Delhi NCR,011 66103710,"North Indian, Continental, Italian",1500,"31- B, Pusa Road, Rajinder Nagar, New Delhi","Mocktails , Dal Makhani , Butter Naan , Pasta , Margherita Pizza , Veggie Pizza , Iced Peach Tea",77.1833152,28.6434865
Duke Bar & Restaurant,Kolkata,033 22219153 033 22345751,"Chinese, North Indian",600,"11, Chittaranjan Avenue, Chandni Chowk, Kolkata","Fish , Fried Rice , Chips",88.3538663,22.56666458
Chai Addaa,Kolkata,+91 9062454275,"Cafe, American, Fast Food",400,"188/13, Prince Anwar Shah Road, Kolkata","Coffee , Pasta , Burgers",88.35764654,22.50213767
My Tasty Corn,Delhi NCR,Not Available,Fast Food,150,"Kiosk 1, Ground Floor, Chaudhary Mall, Nehru Nagar, Ghaziabad",,77.4356341,28.65477715
Badami Sweet & Restaurant,Delhi NCR,+91 9718983030,"Mithai, North Indian",250,"Arihant Garden, Supertech, Greater Noida, Delhi NCR",,77.4424218,28.5787588
Lazeez Chicken,Delhi NCR,+91 9821964054,"North Indian, Chinese",500,"Shop 2 - A, Best Star Mall, Rohini, New Delhi",,77.0852045,28.72852866
Bhookkam,Delhi NCR,+91 8800286663 +91 7908377916,North Indian,100,"Plot 6, Opposite Anupam Appartments, IGNOU Road, Sainik Farms, New Delhi",,77.20647488,28.51837997
Neel Ki Biryani,Mumbai,022 28516262 022 28516363,Biryani,400,"Plot 130, Marol Cooperative Society, M.V Road, Marol, Mumbai",,72.8829319,19.1096507
Ganesh Bikanerwala,Delhi NCR,+91 9210320010 0120 2750619,"Mithai, Street Food",200,"3rd N-25, Ambedkar Road, Ghaziabad",,77.43545305,28.65885192
Hungry Ninja,Delhi NCR,+91 8588913003 +91 9873454454,Chinese,250,"Shop E 361, Double Storey, Ramesh Nagar, Near Kirti Nagar, New Delhi",,77.13115476,28.64784202
Bhushan Cake Shop,Delhi NCR,+91 9555321222,Bakery,450,"C-397, Main Market Road, Bhajanpura, Shahdara, New Delhi",,77.26978172,28.70023028
Bengal Sweet Corner,Delhi NCR,+91 9711015065 011 26104228,"North Indian, South Indian, Chinese, Street Food, Mithai",550,"AB 13, Community Center, Safdarjung Enclave, Safdarjung, New Delhi","Rasmalai , Chole , Gulab Jamun , Rasgulla , Handi Biryani , Chaat , Paneer Jalebi",77.19903611,28.56545341
Good Food Innovations LLP,Delhi NCR,+91 9999408820 +91 9871647102,"North Indian, South Indian, Chinese",400,"C-237, Sector 63 Road, C Block, Sector 63, Noida",,0,0
Ammeez Kitchen,Mumbai,+91 9820009857,Konkan,750,"Blue Monarch A-601, Military Road, Next to Riddhi Siddhi Society, Marol, Mumbai",,72.88002513,19.12052269
Shahi Mahal Restaurant,Kolkata,+91 9433938786,North Indian,300,"B-15, Garden Road, Kidderpore, Kolkata",,88.28765061,22.54852547
South Delhi Chicken Corner,Delhi NCR,+91 9891646319 +91 9958065372,"North Indian, Chinese",350,"G-1, Triveni DDA Shopping Complex, Sheikh Sarai Phase 1, New Delhi",,77.22272269,28.5364318
Sunny Sweets,Delhi NCR,0124 2352111,"Mithai, Street Food",200,"A 6, Qutab Plaza, DLF Phase 1, Gurgaon",,77.1018751,28.47151068
J V's Fried Chicken,Delhi NCR,+91 7979844375,Fast Food,300,"House R-2/44, Pachpan Futta Road, Near Dwarka More Metro Pillar 786, Dwarka More. New Delhi-110059, Near Ma Rani Rasoi.",,77.03065004,28.62010987
Barbeque Nation,Delhi NCR,011 64806060,"North Indian, Chinese, BBQ",1600,"2nd Floor, Munshilal Building, Block N, Outer Circle, Connaught Place, New Delhi","Kulfi , Fish , Biryani , Gulab Jamun , Paneer Tikka , Chicken Tikka , Brownie",77.22078446,28.63032577
I.H.O.B - Indian House of Biryani,Delhi NCR,+91 9811611684 +91 9990700023,"North Indian, Mughlai, Biryani",250,"Sector 110, Noida","Mutton Keema Biryani , Butter Chicken , Raita , Paneer Tikka , Chicken Tikka Biryani",77.36620244,28.53778346
Chinese Cuisine,Delhi NCR,+91 9315948510,Chinese,300,"3rd Floor, Food Court, Opulent Mall, Nehru Nagar, Ghaziabad",,77.43648939,28.65412105
Cafe Istaa,Mumbai,022 61344336,"Cafe, Desserts, Italian, Salad",500,"12 A/1 New Sion C.H.S. Limited, Sion, Mumbai","Pasta , Pizza , Burgers , Waffles , Coffee , Brownie , Jalapeno Poppers",72.86112964,19.04177665
Pepsi Snacks Bar,Kolkata,+91 9641986844,"Street Food, Juices",150,"15/6, Bertram Street, New Market Area, Kolkata","Chole Bhature , Lassi",88.3520082,22.56037573
Leafy Affaire,Kolkata,+91 6291391811 +91 9686244635,"Salad, Italian, Burmese, Mexican",500,"12C, Flat 6A, Lord Sinha Road, Shyamkunj Building, Near Camac Street Area, Kolkata, Theatre Road, Kolkata",Mexican Salad,88.35256174,22.55130668
Masala Mix,Delhi NCR,+91 9711993416,"Fast Food, North Indian",300,"Shop 3, Basant Gaon, Vasant Vihar, New Delhi",,77.15849955,28.57321812
Jugnu Chaap,Delhi NCR,Not Available,"Fast Food, North Indian",400,"F-24/1C, Near Sector 7, Rohini, New Delhi",,77.11198702,28.7091698
Kitchens By SRR Masala,Mumbai,+91 8080343567,Mangalorean,400,"Shop 9, Ground Floor, Next to Vireshwar studio,Military Road, Marol,  Mumbai",,72.88012236,19.11696268
Wake Up Cafe,Delhi NCR,+91 8860473875 +91 9821202285,"Fast Food, Beverages",450,"JA-6, Gupta Colony, Khirki Extension, Near Tikona Park, Malviya Nagar, New Delhi","Burgers , Salad , Cheese Sandwich",77.21680038,28.53520825
Royal Bakers,Delhi NCR,+91 9999886562,Bakery,200,"Plot A 26, Shop 14, Ranjit Vihar, Chander Vihar, Nilothi Extension, Nangloi, New Delhi",,0,0
Bro Cake,Delhi NCR,+91 9999201964,Bakery,200,"339-P, Sector 28, Near DLF Phase 4, Gurgaon",,77.08151512,28.47308215
Noida Chinese Hut,Delhi NCR,+91 9911557669,"Chinese, Fast Food, Street Food",150,"Shop B 164, Sector 46, Near Sector 45 Noida",,0,0
Royal Fast Food Hub,Kolkata,+91 9804998876,Fast Food,200,"176/A, Indira Gandhi Road, Rammohan Place, Konnagar, Kolkata",,88.34374432,22.70232335
New Raj Dairy,Delhi NCR,011 22001189 +91 9891154775,"Bengali, North Indian",500,"F 2/29, Krishna Nagar, New Delhi",,77.284052,28.658339
Pishoriya Vegetarian Dhaba,Delhi NCR,011 25216214 +91 9250956575,North Indian,300,"2/244, Paschim Puri, Main Chowk Red Light, Punjabi Bagh, New Delhi",,77.11686529,28.66716808
Ambarsaria,Delhi NCR,+91 8826270728,"North Indian, Chinese",500,"Shop 48, Devika Tower, Near Pearl Grand Banquet, Ramprastha, Ghaziabad","Masala Chaap , Kadai Paneer , Dal Makhani , Butter Chicken",77.330634,28.6684351
Malvan Kinara,Mumbai,+91 7506077718,Malwani,600,"Shop 7, Building 54/2, Shree CHS, Tilak Nagar, Chembur, Mumbai",,72.89480545,19.06716303
Kerala - Kingdom of Dreams,Delhi NCR,0124 4528000,Fast Food,400,"Culture Gully, Kingdom of Dreams, Great Indian Nautanki Company Ltd, Auditorium Complex, Sector 29, Gurgaon",,77.06818219,28.4685009
New Arsalan Biryani,Kolkata,+91 9304074989 +91 7003092050,Biryani,200,"7/2 K.C. Sen Road, Near Rishra Medical Service, Rishra, Kolkata",,88.34110402,22.72385108
Sana Egg Roll,Delhi NCR,+91 9958689014,Rolls,200,"7/8, Munirka Rama Market Munirka Village, Munirka, New Delhi",,77.16983791,28.56098336
Brew Sixteen,Delhi NCR,+91 9599803286 +91 9891915061,"Pizza, Sandwich, Fast Food, Beverages",800,"K-3/106, Dakshin Marg, DLF Phase 2, Gurgaon","Coffee , Sandwich , Pizza , Cappuccino",77.08602928,28.48214091
Lobby Bar - Zone By The Park,Kolkata,033 23246300,"North Indian, Continental",1500,"Gate 04, DG Block, Biswa Bangla Convention Center, New Town, Kolkata",,88.474664,22.582356
Ishu Paan,Delhi NCR,+91 9821225872,Paan,100,"Plot 11, Kiosk 2, Golf City Mart, Sector 75, Near Sector 72, Noida",,77.38021798,28.57156511
Chaat Chobara,Delhi NCR,+91 9953931334,Street Food,200,"Shop 6A, 2nd Floor, MGF Metropolis Mall, MG Road, Gurgaon","Chole , Dahi Bhalle , Vada Pav , Tikki , Pav Bhaji",77.08207536,28.47821784
New Modern Cafe,Mumbai,0251 2443644,"North Indian, Chinese, South Indian, Fast Food, Beverages",450,"1, Chirag CHS, Phadke Road, Dombivali East, Mumbai","Pav Bhaji , Masala Dosa , Pizza , Faluda , Sandwich , Dal Kichadi , Vada",73.09036598,19.21920957
Mishti's Kitchen,Delhi NCR,+91 8800344307 +91 8800196462,Mughlai,550,"H-38, Sector 51, Noida","Butter Chicken , Biryani , Kadhai Paneer , Naan , Dal Makhani , Roti , Tandoori Chicken",77.3694886,28.5791586
Anjali Resaturant,Delhi NCR,+91 9873859865 +91 8587865264,North Indian,300,"B-72, New Ashok Nagar, Vasundhara Enclave, New Delhi",,77.30670266,28.59136359
Yummy In Tummy,Delhi NCR,+91 9711067878,"Chinese, North Indian, Rolls",350,"Shop G23, Ground Floor, Nipun Wonder Mall, Shakti Khand 2, Indirapuram, Ghaziabad",,77.36901306,28.64737595
Rajinder Da Dhaba,Delhi NCR,011 26100355 011 41653145,"North Indian, Rolls",800,"AB-14, Safdarjung Enclave Market, Safdarjung, New Delhi","Butter Chicken , Chicken Curry , Chicken Satay , Galauti Kebab , Dal Makhani , Fish , Tandoori Chicken",77.19927415,28.56544722
Jia Mom's,Delhi NCR,+91 9811103704 +91 8700514813,Fast Food,300,"J-5/102, 1st Floor, Rajouri Garden, New Delhi",,77.109966,28.668635
Om Vati Sweet,Delhi NCR,+91 7838669095,"Mithai, Street Food",200,"Jhrasha, Near Medanta Hospital, Sector 39, Gurgaon",,77.04614852,28.4393851
Little Loco Pops,Mumbai,+91 9769389854,Ice Cream,250,"Shop 1, Blue Jewel Building, Ahimsa Marg, Near Malad Link Road, Malad West, Mumbai",,72.83909403,19.17450193
Gravies,Delhi NCR,,"North Indian, Biryani, Mughlai",,"Adjacent Main Market, Hauz Khas, New Delhi","Hyderabadi Biryani , Murgh Lababdar , Boondi Raita , Chicken Tikka Masala , Chicken Biryani , Butter Chicken , Mutton Biryani",77.20766075,28.55788425
Asharam Foods,Delhi NCR,011 41523612 +91 9999665242,North Indian,250,"755, First Floor, Opposite Town Hall, Chandni Chowk, New Delhi",,77.22756341,28.65622967
Bell Pepper,Kolkata,+91 6291109805,North Indian,900,"1B, Emon Kalyan, 352, Kalyannagar, Bokultala, Rahara, Khardah, Kolkata",,88.389615,22.721012
Rapture,Delhi NCR,+91 9999950652,"Bakery, Fast Food",400,"B-11, B Block Market, Vivek Vihar, New Delhi","Sandwich , Brownie , Pasta , Chocolate Truffle , Garlic Bread , Eggless Cake , Fries",77.31811881,28.67120708
Kamaluddin Restaurant,Mumbai,022 23778003 +91 9619407107,"Chinese, Mughlai",500,"103/105, Mount Road, Sant Savta Marg, AGA Building, Mustafa Bazar, Naka Mazgaon, Byculla, Mumbai",,72.84063924,18.9763383
Anju Restaurant,Delhi NCR,+91 8800779290 +91 9582785633,North Indian,100,"285, Munirka Village Baburam Chowk, Munirka, New Delhi",,77.17076529,28.55690979
Choudhary Gohana Famous Jalebi,Delhi NCR,+91 9466825157,"Mithai, North Indian",300,"513/18  civil line sohna road, Gurgaon",,77.03134842,28.45112813
D'Momo Factory,Delhi NCR,+91 9315470120,"Chinese, Thai, Momos",450,"Shop G-11, Aditya Complex, Plot 1, KP Block, Community Center, Maurya Enclave, Pitampura, New Delhi","Noodle , Momo Burger , White Sauce Pasta , Tandoori Paneer Momos , Chicken Momo Platter , Wheat Momo , Wings",77.14173889,28.70529747
New Town Bakery,Kolkata,+91 9804750827,"Bakery, Chinese, North Indian, Italian",500,"Rajarhat Road, Atghara Check Post, Near Indian Bank, Chinar Park, Kolkata",,88.44592005,22.62782311
Bowl Baby Bowl,Delhi NCR,0124 4286537,"Mexican, Continental",1000,"Unit 2A, Amenity Block 2, Candor Infospace, Sector 21, Gurgaon",,0,0
Lazeez Chicken Corner,Delhi NCR,+91 9643963285,North Indian,300,"Shop 193, 2nd, Block C, Masjid Wali Gali, New Ashok Nagar, Vasundhara Enclave, New Delhi","Chicken Biryani , Tandoori Roti , Chicken Stew , Chicken Rara , Tawa Roti",77.30760824,28.59187023
Fabelle Exquisite Chocolates,Kolkata,+91 7604053717,Desserts,900,"33, Quest Mall, Syed Amir Ali Ave, Beck Bagan, Ballygunge, Kolkata",,88.36567339,22.5390986
Bunooro Barbeque,Delhi NCR,+91 8882053894 +91 8285300964,"Continental, Chinese",200,"Shop 83132, Sombazar, Near Bahadurgarh Bus Stand, Najafgarh, New Delhi",,76.98008403,28.61323456
Nawab Seekh Corner,Mumbai,+91 7977199258,"Rolls, Kebab",300,"Plot 84, Shop 84B, Ground Floor, Patel Chawl, Chakala Market, Mohammad Ali Road, Mumbai",,72.83456471,18.95017288
Vrinda's Food,Delhi NCR,011 22329106 +91 8800119964,"North Indian, Chinese, South Indian, Bakery",600,"725, Main Babarpur, Rohtash Nagar, Shahdara, New Delhi",,77.29015745,28.67649018
Don's Den,Delhi NCR,Not Available,"North Indian, Chinese, South Indian, Continental",500,"Unit 202, 2nd Floor, PP Tower, Netaji Subhash Place, New Delhi",,0,0
Hotel Ambika Pure Veg,Mumbai,0251 2438937 0251 2434636,"North Indian, Chinese, South Indian",550,"Jairam Sadan, Phadke Road, Dombivali East, Mumbai Dombivali East","Pav Bhaji , Manchurian , Paneer Tikka Masala , Idli Sambar , Lassi , Khichda , Pizza",73.08979802,19.21868119
Chowpati,Delhi NCR,0120 4578800,Street Food,300,"Food Court, Logix City Center Mall, Sector 32 Noida, Near Sector 34, Noida","Bhel Puri , Panipuri",77.3536098,28.57430166
Lust By The Pool - Radisson Blu Kaushambi Delhi NCR,Delhi NCR,+91 8744059822,Asian,1500,"H-3, Sector 14, Kaushambi, Ghaziabad",,77.32799303,28.6375113
KSC,Delhi NCR,Not Available,"North Indian, Chinese",400,"Shop 17, DDA Market, AG 1, Vikaspuri, New Delhi","Tawa Paneer , Soya Malai Tikka , Tandoori Chicken , Singapuri Chowmein",77.06777383,28.62807861
Bukhara - ITC Maurya,Delhi NCR,011 46215152 011 66325124,"North Indian, Kebab",6500,"ITC Maurya, Chanakyapuri, New Delhi","Dal Bukhara , Naan , Dal Makhani , Raan , Jumbo Prawns , Paneer Tikka , Rasmalai",77.17324533,28.59792182
Zaiqa Mediterranean And Asian Cuisine,Kolkata,+91 7044396311,"Mediterranean, Asian",250,"33, Royd Street, Opposite AG School Junior Section, Park Street Area, Kolkata",,88.35711714,22.55213559
Jayka The Restaurant,Delhi NCR,0120 4561347 +91 9205722978,"Chinese, Mughlai, North Indian",800,"70, Shakti Khand 4, Indirapuram, Ghaziabad",,77.36948077,28.64783113
Lorreta's Sweet Inspirations,Mumbai,+91 9867235126 +91 8097598395,"Bakery, Desserts",350,"Gonsalves Villa, Karadi Wadi, Sandor, Bangli-Papdy Road, Opposite Carmelite Convent High School,  Vasai, Mumbai",,72.80674107,19.3605459
Kushal Ki Rasoi,Delhi NCR,+91 9582646190,North Indian,200,"119, Mansa Ram Chowk, Munirka Village, Munirka, New Delhi",,77.16992475,28.55473468
Aashirwad,Delhi NCR,+91 9871882019,"North Indian, Chinese",450,"A 1, Acharya Niketan, Mayur Vihar Phase 1, New Delhi","Paratha , Malai Kofta , Chole , Dum Aloo , Roti",77.29242124,28.60899701
Jadukadai,Kolkata,+91 9432683250,"North Indian, Chinese",300,"102/A/23, Lal Bahadur Sastri Road, Konnagar, Kolkata",,88.34266204,22.69831105
Shri Ram Bhojnalaya,Delhi NCR,+91 9536242534,North Indian,350,"250 B, Main Parmanand Road, Near MCD Office, Mukherjee Nagar, New Delhi",,77.205126,28.710517
Royal Cafe,Delhi NCR,+91 8745080450,Fast Food,400,"Shop 01, Gardenia Glory Market, Near Sector 46, Sector 45, Noida",,77.359921,28.550151
The Friendz Pizza,Delhi NCR,+91 7037426233,Pizza,200,"Shop 4, 9A/A, Nathi Chowk, Nehru Ground, NIT, Faridabad",,77.30534412,28.38617021
UG Cafe Bar - HHI,Kolkata,+91 9831252442 033 22802323,"Continental, Mexican, Desserts, Italian, Afghan",1000,"Hotel Hindusthan International, 235/1, A.J.C. Bose Road",,88.35054673,22.54162546
Mirch The Multicuisine,Delhi NCR,+91 7428812556,"North Indian, Chinese",300,"G 18, TedX Tower 2, Commercial Belt, Alpha 1, Greater Noida",,77.51443338,28.47306034
Asia,Delhi NCR,011 64649392 +91 9818635936,North Indian,500,"Main Mangal Bazar Road, Opposite Dhingra Garments, Dilshad Garden, New Delhi",,77.31944684,28.68030409
The Pavor's,Delhi NCR,00 1161495257,"North Indian, Chinese, Momos",650,"C4F, DDA Market, Janakpuri, New Delhi",Spring Roll,77.09029969,28.61696188
Paramjeet Machi Wala,Delhi NCR,011 25417932 +91 9810195318,"Seafood, North Indian",700,"WZ-1, Opposite Metro Station, Basai Darapur Road, Moti Nagar, New Delhi","Fish Tikka , Chicken Seekh Roll , Rolls , Chicken Tikka , Fish Fry , Malai Tikka , Tandoori Fish",77.13952795,28.65619289
Mathur's Kitchen,Delhi NCR,+91 7065000490 +91 8510000490,"North Indian, Mughlai",300,"Shop 1 & 2, DDA Market, Pocket F, G.T.B. Enclave, Dilshad Garden, New Delhi",,77.31423464,28.68428669
