name,city,telephone,cusine,cost_for_two,address,famous_food,longitude,latitude
Burmese Bahar,Kolkata,00 983074903,Burmese,500,"Pioneer Park, Helabattala, Barasat, Barasat, Kolkata",,88.47875968,22.72392623
Chinese Garage,Delhi NCR,+91 8376800777 +91 7042722442,"Chinese, Momos",600,"East of Kailash, New Delhi","Noodle , Spring Roll , Manchurian , Honey Chilli Potatoes , Chilli Paneer , Momos , Hakka Noodles",77.2456073,28.55816577
Sardar Kachori,Delhi NCR,+91 9650757202,Street Food,100,"B 1619, Near Shastri Nagar Metro Station, Inderlok, New Delhi",,77.180415,28.678641
Hungryy Birdz,Kolkata,+91 7076444476 +91 9830304747,"Chinese, North Indian",400,"7/1, Srijoni Road, Opposite Thakurpukur Cancer Hospital, Thakur Pukur, Kolkata","Noodle , Chicken Roll , Chowmein",88.31783015,22.45912716
Patiala Shahi Chicken & Fish Fry,Delhi NCR,+91 8512895649 +91 9910439241,North Indian,400,"Gate 6, Opposite DDA Market, Paschim Vihar, New Delhi",,77.08289009,28.65922408
Cake Paradise,Kolkata,Not Available,Bakery,400,"G4, BA 14/8, Shibalay Apartment, Near Sports Council Club, Baguihati, Kolkata",,88.42483755,22.61350175
Smart Cafe,Delhi NCR,+91 8287688777 +91 9911597067,"Cafe, Fast Food",200,"KO 17, Near ACS Group, Amity College Gate 2, Sector 126, Near Sector 125, Noida",,0,0
Burger King,Delhi NCR,011 41403240,"Burger, Fast Food, Beverages",500,"2nd Floor, Select Citywalk Mall, Saket, New Delhi","Burgers , Fries , Mutton Whopper , Salad , Chicken Whopper , Chilli Cheese Melt , Onion Rings",77.21928477,28.52912124
The Great Bowl Of China,Delhi NCR,+91 7290070800,Chinese,400,,,77.37647295,28.51391382
Tulsi,Mumbai,+91 9820420375,"Chinese, Italian, Fast Food",700,"34A, Raj Arcade, Opposite D Mart, Mahavir Nagar, Kandivali West, Mumbai","Pasta , Nachos , Pizza , Noodle , Fries , Spaghetti , Hakka Noodles",72.84167022,19.21310751
Anjana Cafe,Delhi NCR,+91 7011819036,Cafe,300,"1022, Maruti Vihar, Chakkarpur, MG Road, Gurgaon",,77.08265975,28.47626716
Delivery Panda,Delhi NCR,+91 9953991099,"North Indian, Chinese, Continental",500,"13, Gate Police Station, Block C, Vijay Nagar, New Delhi",,77.20108867,28.69162234
Munna Di Vaishno Rasoi,Delhi NCR,+91 9911154556 +91 9810868569,North Indian,200,"B-781, Sir Chotu Ram Marg, Avantika, Sector 1, Rohini, New Delhi",,77.09874529,28.70289407
Roll X,Delhi NCR,+91 9958622709,Rolls,300,"Shop 58, Mini Central Market, DDA Flats, Kalkaji, New Delhi","Rolls , Lemonade , Fries , Chicken Egg Roll",77.25693762,28.53069009
Sindhudurg,Mumbai,022 25832970 022 25829952,"Malwani, Seafood",450,"Krishna Sadan, Mulund Check Naka, Wagle Estate, Thane West","Sea Food , Malwani Food , Surmai Fry , Chicken Sukha , Fish Fry , Bombil Fry , Sol Kadhi",72.95524433,19.18695002
Lucky's Bakery and Patisserie,Delhi NCR,+91 7503347103 01 142071051,"Bakery, Desserts",400,"2/80, Club Road, West Punjabi Bagh, Punjabi Bagh, New Delhi","Walnut Cake , Date Cake , Brownie Chocolate , Red Velvet Jar , Ferrero Rocher Cake , Brownie Cheesecake , Marble Cake",77.12715961,28.66587163
Dosae,Delhi NCR,+91 9205109685,South Indian,500,"1411B/13, Baba Fateh Singh Marg, Kalkaji, New Delhi",,77.2658154,28.53188099
Pizzeria Cafe,Delhi NCR,+91 9625018028 +91 8285280476,"Chinese, Continental",400,"Shop SC-160, Jaipuri Sunrise Plaza, Doctor Sushila Naiyar Marg, Ahinsa Khand 1, Indirapuram, Ghaziabad","Pizza , Burgers , Fried Rice , Chicken Sandwich , Chilli Chicken , Chocolava Cake",77.37704694,28.63976944
Chawla Chick Inn,Delhi NCR,+91 8744900010 +91 8744900011,"Mughlai, North Indian, Chinese",500,"Near Corporation Bank, Sector 1 Market, Manesar, Gurgaon",,76.94717903,28.36684332
Cake Point,Delhi NCR,011 65422732 +91 9871741906,"Bakery, Desserts",200,"WZ 26, Vashishth Park, Pankha Road, Janakpuri, New Delhi","Chocolate Mud Cake , Blackforest Cake , Chocolate Truffle Cake , Pineapple Cake",77.10240785,28.60843658
Pizza Boys,Mumbai,022 68493490,"Italian, Pizza",500,"Shanti Sadan, Walabhdas Compund, Opp. Ganga Niwas, Next to Lakozy Toyota Showroom, Off Chicholi Bunder Road, Malad West, Mumbai","Cottage Cheese Burger , Cheesy Garlic Bread , Peri Peri Fries , White Sauce Pasta , Hawaian Pizza , Chiku Shake , Butter Chicken Pizza",72.83598326,19.1811118
Ajooba Biryani Junction,Kolkata,+91 9051361085,North Indian,300,"Shop 27 & 28, Near Peerless Hospital, Pancha Sayar, Garia, Kolkata",,88.3927295,22.48358674
Snack Shack,Kolkata,+91 9830678655 +91 9903994234,"Fast Food, Street Food",350,"54, NSC Bose Road, Mahamaya Apartment, Besides Spencers, Narendra Pur, Kolkata","Pav Bhaji , Sandwich , Momos , Chaat",88.38679673,22.45464826
Prem Rasoi,Delhi NCR,+91 7042948034 +91 9971147024,North Indian,400,"E - 197 A, LIG Flates, GTB Enclave, Dilshad Garden, New Delhi",,77.30953876,28.68797325
Coastal Reef,Delhi NCR,00 1244119757 +91 9810149757,"Kerala, Andhra, Seafood, South Indian",2000,"SF 91, Near Airtel, DLF Galleria, DLF Phase 4, Gurgaon","Appam , Chicken Chettinad , Fish , Sea Food , Murgh Ghee Roast , Biryani , Chicken 65",77.08169717,28.46760756
The Biryani Darbar,Kolkata,+91 7908144616,"Biryani, North Indian, Chinese",400,"Gate 2, Shahpoorji Complex, New Town, Kolkata",,88.514078,22.565736
Saravana Mess,Delhi NCR,+91 7292071185 +91 7292071186,"South Indian, North Indian",350,"15A/9, WEA Karol Bagh, Karol Bagh, New Delhi",,77.18825296,28.64541016
A1 Food Service,Delhi NCR,+91 8510852057,"North Indian, Chinese",300,"Old Palam Road, Near MBD School, Sector 15, Dwarka, New Delhi",,77.03122504,28.61091492
McDonald's,Delhi NCR,011 66000666,"Burger, Fast Food",500,"P-16, Atta Market, Sector 18, Noida","Burgers , Fries , Spicy Chicken , Aloo Tikki Burger , Mc Chicken , Maharaja Mac , Paneer Wrap",77.3246178,28.56931022
Rajubhai Dhoklawala,Mumbai,+91 9821356977 +91 9773355199,"Street Food, Desserts",150,"9, Om Sai Ratna Rajul Building, Mahatma Gandhi Road, Kandivali West, Mumbai","Farsan , Fafda , Dhokla Pizza , Jalebi , Dabeli Dhokla , Samosa",72.84323461,19.20554372
Duggal's Rasoi,Delhi NCR,+91 9910274274 +91 9910273273,"North Indian, Mughlai",600,"125, Flyover Market, Defence Colony, New Delhi","Dal Makhani , Chicken Tikka , Tandoori Chicken , Rolls , Shawarma",77.23885585,28.57814578
Sugar & Spice,Delhi NCR,+91 9660466686,"Bakery, Fast Food",700,"Ground Floor, Basant Lok, Priya Cinema Complex, Vasant Vihar, New Delhi",,77.16374628,28.55730676
Delish,Delhi NCR,+91 8800560500 +91 8851766605,"Chinese, Fast Food",350,"B-6/1, Double Storey, Opposite Metro Pillar 371, Ramesh Nagar, Moti Nagar, New Delhi",,77.14155436,28.66474108
Cherry Bar - The Leela Ambience Convention Hotel,Delhi NCR,011 71721234 +91 8130990916,Finger Food,3000,"The Leela Ambience Convention Hotel, Maharaja Surajmal Road, Near Yamuna Sports Complex, Vivek Vihar, New Delhi","Cocktails , Tikka",77.30278395,28.66165092
Sindhi Meat & Chicken,Delhi NCR,+91 9540535500 +91 9540532200,North Indian,400,"Shop 3, DDA Market, Sector 22, Dwarka, New Delhi",,77.06000519,28.56116867
Urban Cuisine,Delhi NCR,+91 9718269111,"North Indian, Chinese, Mughlai",500,"Shop 2, Tigaon Road, Near Sai Dham Mandir, Sector 86, Faridabad","Butter Chicken , Paneer Angara , Dal Makhani",77.34101247,28.40795192
Jhama Silver Sweets,Mumbai,022 27548621,"Mithai, Street Food",100,"4, Ajanta Building, Sector 15, Kopar Khairane, Navi Mumbai","Panipuri , Chaat , Sev Puri",73.00553307,19.09956925
Khana Khazana,Delhi NCR,+91 8377855274,North Indian,200,"398/11, Near Colony Market, Opposite Bata, Old Railway Road, Gurgaon",,77.01748241,28.46731577
Southy,Delhi NCR,+91 9312011011,South Indian,450,"Super Mart 2, Kasera 505-506, Sector 43, DLF Phase 4, Gurgaon","Rava Masala Dosa , Vada Sambar , Lemon Rice , Idli , Upma",77.08860587,28.46099758
TLC Kitchen,Delhi NCR,+91 8587870611,"North Indian, Chinese",400,"9-A, Qutub Vihar, Jhankar Road, Block G, Goyla Village, Sector 19, Dwarka, New Delhi",,77.025086,28.576386
Lucknow,Kolkata,+91 9748709693,"North Indian, Fast Food",200,"223/B, Dum Dum, Kolkata","Chicken Biryani , Paratha",88.40774886,22.62208515
Nimtho,Delhi NCR,011 49093620,"Nepalese, Chinese, Asian",1100,"1st Floor, R Block, Pamposh Enclave, Greater Kailash (GK) 1, New Delhi","Momos , Pork Ribs , Thali , Thukpa , Pork Momo , Chilli Momo , Chicken Curry",77.24431012,28.54723102
The Cone Factory,Mumbai,+91 8369476552 +91 7777039582,Italian,300,"Ground Floor, Jatia Chambers 60, Dr V.B. Gandhi Marg, Kala Ghoda, Fort, Mumbai","Cone Pizza , Paneer Tikka , Peri Peri Chicken , Paneer Peri Peri , Smoked Chicken , Chicken Tikka , Chipotle Chicken",72.83264358,18.92826554
The Artistic Desserts,Kolkata,+91 9748791032,"Bakery, Desserts",150,"EA 10/10, Desh Bandhu Nagar, Baguihati, Kolkata",,88.42336066,22.61281744
Cocoaaahhh,Delhi NCR,+91 9899787433,Desserts,200,"N 241, Greater Kailash (GK) 1, New Delhi",,77.23276723,28.55659528
The Ahare Bahare Kitchen,Kolkata,+91 9674983507 +91 8276818781,Bengali,500,"13/B,Biren Roy Road(West). Near Barisha Yubok Brindo Club, Behala Chowrasta.",Fish Pakoda,88.312082,22.485758
Chawla Express,Delhi NCR,011 27654750,"North Indian, Mughlai, Chinese, Fast Food",450,"1341, Near Batra Cinema Hall, Mukherjee Nagar, New Delhi",,77.21559608,28.71251885
Raju Grill,Delhi NCR,+91 8173954785 +91 8840013708,Fast Food,400,"Main Market, Sector 11, Faridabad",,77.31844068,28.37193136
Dear Donna,Delhi NCR,+91 9139646464,"Finger Food, American",3000,"Ground Floor, Qutub Hotel, A Block, Shaheed Jeet Singh Marg, Block C, Qutab Institutional Area, New Delhi","Cocktails , Pizza , Sushi , White Sauce Pasta",77.18871698,28.53848358
Greasy Spoon Cafe,Delhi NCR,+91 8826933247,"Fast Food, Chinese",200,"LG 49, The Next Door Mall, BPTP, Sector 76, Near Sector 81, Faridabad",,0,0
Yo Munching,Delhi NCR,+91 9873152913,Chinese,200,"Near Gabba Kothi, New Colony, Circular Road, Sector 7, Gurgaon",,77.01404985,28.46852654
Amritsari Express,Delhi NCR,+91 8287509838,North Indian,400,"Shop A11, Sector 52, Near Sector 53, Gurgaon",,0,0
Chutney D'Lite,Delhi NCR,+91 9717485388 +91 8800662866,North Indian,600,"23/1, Community Center, PVR Anupam Complex, Saket, New Delhi","Dal Makhani , Naan , Butter Chicken , Malai Kofta , Dal Tadka , Chicken Tikka Masala , Tandoori Chicken",77.20683094,28.52331167
Nanuji- By Nanumal Bhojraj,Mumbai,022 61736004,"North Indian, Chinese, Continental",700,"7&8, Plot D2M, Landmark CHS Limited, Prime Mall Lane, Sector 12, Kharghar, Navi Mumbai",,73.064282,19.040446
Yam Food Point,Delhi NCR,+91 9958647110 +91 9971087047,"South Indian, North Indian",400,"Shop 62, Ground Floor, New Railway Road, Bhim Nagar, Sector 4, Gurgaon",,77.02240091,28.47054781
The Burger Week,Delhi NCR,Not Available,"Burger, Beverages",150,"B-356, Hari Nagar Clock Tower, Mayapuri Phase 1, New Delhi",,77.11574379,28.62585848
Shahenshah,Delhi NCR,+91 8076597771 +91 8700756520,"North Indian, Mughlai, Chinese",500,"Shop no.1, 1st floor opposite pillar no 226, Hoshiarpur market Sec 51","Chicken Biryani , Dal Makhani , Murgh Lababdar , Chicken Rara , Malai Kofta , Butter Chicken , Naan",77.36814804,28.58335909
Orange And Chilli Biryani,Mumbai,+91 9833388804,"North Indian, Chinese, Biryani",500,"Shop 48, Shell Colony Road, Opposite Padma Palace, Chembur, Mumbai",,72.89622501,19.06401098
Dear Chocolate,Delhi NCR,+91 9599474449,Desserts,200,"Plot 1, Vinoba Puri, Lajpat Nagar 2, New Delhi",,77.24849705,28.56657413
Wakhra Swag By Mafia Kitchen,Delhi NCR,+91 8588960417 +91 8588960917,"North Indian, Mughlai",1000,"Hotel P.K. Residency, B 2, Sector 27, Noida","Chicken Curry , Butter Chicken",77.33160287,28.57391312
Ghare Baire,Kolkata,+91 9748272939 033 32628326,"Bengali, Bangladeshi",400,"204, Harish Mukherjee Road, Near Sangam Beauty Parlour, Hazra, Kolkata","Mutton Kasha , Mutton Dak Bunglow , Veg Thali , Chital Muitha , Luchi",88.34392671,22.52378564
TIME PASS,Kolkata,+91 9748608847,"Fast Food, Street Food",200,"Shop 12, H.C Dutta Road Sodepur, Khardah, Kolkata",,88.38251766,22.7024616
Night Out cafe,Delhi NCR,+91 9999923912 +91 9318939895,"North Indian, Continental, Chinese, Italian",500,"5/25/2/2, Ground Floor, Village Sahipur, Behind Krishna Apartments, Shalimar Bagh, New Delhi",,77.1602802,28.7146615
Damru Paan Shop,Mumbai,+91 9869324888,Paan,100,"Shop 1, Dama Villa, Near Kora Kendra Ground, Borivali West, Mumbai","Paan Shot , Meetha Paan , White Chocolate Paan , Ladoo",72.84775078,19.22050632
Gujrati Basa,Kolkata,00 08420134998,Gujarati,300,"1, Rupchand Roy Street, Bara Bazar, Kolkata",,88.35553698,22.57918445
Punjabi Rasoi,Delhi NCR,+91 7042327916,North Indian,300,"7/24 U Block, DLF Phase 3, Gurgaon","Dal Makhani , Paratha , Kadhai Paneer",77.09489297,28.49166094
Om Bakers,Delhi NCR,+91 9582507869,"Bakery, South Indian, Street Food, Mithai",200,"Shop 3, C Block, Main Market, Near Police Booth, Jahangirpuri, Azadpur, New Delhi",,77.16712654,28.72998574
Cafe Youth,Delhi NCR,+91 9711221953 +91 9711988487,Chinese,400,"Main Road, Near BSES Office, Vasundhara Enclave, New Delhi",,77.31232356,28.59778553
Hotel White Castle,Delhi NCR,+91 9773581122,"North Indian, Chinese",400,"Goyal Colony, Dadri Main Road, Near Bhangel Police Chowki, Sector 82, Near Sector 93, Noida",,77.38572791,28.54299317
Modi Bakery,Delhi NCR,+91 9899420199,Bakery,150,"42, Central Road, Bhogal, Jangpura Extension, Jangpura, New Delhi",,77.24826034,28.58240312
Manjeet Chicken Centre,Delhi NCR,011 27655158 +91 9213451564,North Indian,650,"GF-1, A-12/13, Ansal Building, Commercial Complex, Near Batra Cinema, Mukherjee Nagar, New Delhi","Butter Chicken , Tawa Chicken",77.21626762,28.71177485
New Airport Restaurant,Mumbai,022 29255552 022 29255553,"North Indian, Mughlai",600,"Noori Baugh, Opposite Star Chemical, Below Airport Metro Station, Andheri Kurla Road, Marol Naka, Marol, Mumbai","Caramel Custard , Tandoori Chicken , Butter Chicken , Tandoori Roti , Pudding , Mutton Biryani , Murgh Angara",72.87550595,19.10972332
Cafe Rendezvous,Delhi NCR,+91 9871466855 +91 9910011044,"Asian, North Indian, Continental, Momos",1500,"T-540, The Panchshila Rendezvous, Panchshila Park, Malviya Nagar, New Delhi","Pasta , Butter Chicken , Naan , Dal Makhani , Margherita Pizza , Mutton Roganjosh , Malai Kofta",77.21306708,28.53956895
The Burger Homes,Delhi NCR,+91 9899527184,"Burger, Fast Food",300,"House 377, Sector 31, Gurgaon",,77.048966,28.456182
My Bar Headquarters,Delhi NCR,011 43583313 +91 7838271741,"North Indian, Mughlai, Chinese",1300,"Shop N 49, 2nd Floor, Connaught Place, New Delhi","Pizza , Beer , Cocktails , White Sauce Pasta , Chocolate Truffle , Mocktails , Honey Chilli Potatoes",77.21967202,28.63053913
Karan Momos Corner,Mumbai,+91 7219004407,Momos,200,"Shiv Mandir Road, Near Mayflower Garden, Shiv Ganga Chowk, Ulhasnagar, Thane",,73.18019215,19.20224581
Juice Bar,Delhi NCR,+91 8527838241,"Juices, Beverages",150,"Jain Nagar, 40 Feet Road, Opposite Bliss Fitness, Sector 37, Rohini, New Delhi",,77.05464743,28.72964558
Oye Hotdogs,Delhi NCR,+91 9560770750,Fast Food,200,"K-14-A, Kalkaji, New Delhi",White Sauce Pasta,77.25536987,28.52838571
Tasty Place,Delhi NCR,+91 8700884160 +91 9818846172,"North Indian, Chinese",300,"S-9, Budh Bazaar Road, Mohan Garden, Uttam Nagar, New Delhi",,77.03203876,28.63342657
Zoe,Delhi NCR,+91 9205534967,"Juices, Beverages, Healthy Food",700,"3436, Sector 23, Gurgaon","Salad , Mocha Frappe , Chicken Sandwich , Tea , Yoghurt Parfait , Cinnamon Frappe , Detox Water",77.09081467,28.49671676
Heart Bites,Kolkata,+91 8420420553,Fast Food,150,"A/69, Baghajatin Colony, Ashirbad Market, Baghajatin, Kolkata",,88.371433,22.485325
Candle Heart Restaurant,Delhi NCR,+91 8510005105,"North Indian, Chinese, Continental, Beverages",600,"89, Shivpuri Main, Vijay Nagar, Thana Road, Pratap Vihar, Ghaziabad",,77.42176741,28.64121393
Teens Cafe Fast Food,Delhi NCR,Not Available,Chinese,200,"G-19, Plot 10, Local Shopping Complex, Preet Vihar, New Delhi",,77.29603484,28.64275432
O Zone Restaurant & Bar,Kolkata,033 32562637,"North Indian, Chinese",1200,"Meridian Mall, 1st Floor, 2/4, Raghunathpur, V.I.P. Road, Baguihati, Kolkata",,88.43130335,22.61705105
Sesame Street Wok Dis Way,Delhi NCR,+91 9837178627,"Chinese, Fast Food",250,"Near Ims College, National Highway 24, Adhyaatmik Nagar, Shastri Nagar, Ghaziabad",,0,0
Tingly Vingly,Mumbai,+91 9773435235 +91 7743999888,"Chinese, Fast Food, Beverages",350,"7/10, Bara Chawl, Sitaram Jadhav Marg, Lower Parel, Mumbai",,72.82739047,18.99636197
The Royal Spice,Kolkata,+91 9062937537 +91 9062725181,"North Indian, Chinese, Continental, Italian",400,"21 BT Road, 4th Floor, Sodepur, Kolkata","Mocktails , Hakka Noodles",88.37451596,22.70334527
Park Balluchi,Delhi NCR,0120 4959775 +91 9205780775,"Mughlai, North Indian, Chinese",750,"CS 5 & 5A, Prateek Walk, Near Prateek Wisteria, Sector 77, Near Sector 72, Noida","Dal Makhani , Butter Chicken , Paneer Lababdar , Malai Kofta , Murgh Makhanwala , Pizza , Biryani",77.38940287,28.57120589
Vaishu's Noodles,Delhi NCR,+91 9304085513,Chinese,300,"Shop 3, Near Pioneer Park, Sector 62, Near Sector 57, Gurgaon",,77.091536,28.410548
Jai Mata Di Fast Food Corner,Delhi NCR,+91 7011790335,"North Indian, Chinese, Fast Food",100,"H-51B, New Govindpura, Som Bazar Road, Chander Nagar, New Delhi",,0,0
Omelettes A Multi Cuisine Restaurant,Delhi NCR,011 41538802 011 41538302,"Fast Food, North Indian, Chinese",400,"34A,64, Rajendra Bhawan, Rachna Cinema Complex, Rajendra Place, New Delhi","Butter Chicken , Biryani , Sandwich , Chicken Tikka , Omelette , Pizza , Chicken Chowmein",77.17753418,28.64334075
Pahalwan Da Dhaba,Delhi NCR,+91 9911171683,North Indian,300,"Kabir Bhawan Chowk, Old Railway Road, Gurgaon",,77.01923188,28.47122804
Shree Bikaner Sweets,Delhi NCR,+91 9958626989,"Fast Food, Mithai",200,"144, Taimoor Nagar, New Friends Colony, New Delhi",,77.26636559,28.5717568
Lakeside,Mumbai,+91 7719088222 +91 7757881868,"North Indian, Chinese, Seafood, Mughlai",600,"Martin Commercial Complex, Link Arcade, Achole Road, Nalasopara East, Nalasopara, Mumbai","Chicken Tikka Biryani , Butter Chicken",72.82631289,19.40998153
Haldiram's,Delhi NCR,011 47685300 011 47685301,"Mithai, North Indian, Street Food, Chinese, South Indian",550,"L-6, Outer Circle, Connaught Place, New Delhi","Raj Kachori , Pav Bhaji , Chole Bhature , Thali , Chaat , Rasmalai , Lassi",77.22226739,28.63423523
Noorani Restaurant,Mumbai,022 25494864 022 25356697,"North Indian, Chinese, Mughlai, Fast Food",600,"Aafrin Apartment, Bombay Pune Road, Kausa, Mumbra, Thane",,73.0248091,19.16905789
Prince Misthaan cafe,Delhi NCR,+91 9599958108 +91 9599958208,"North Indian, Chinese, South Indian",400,"7, Mehrauli Badarpur Road, Opposite RPS Colony, Khanpur, New Delhi",,77.2296381,28.51479204
A K Foods,Delhi NCR,+91 8383879337,"North Indian, Fast Food",400,"Shop G-11, Panchsheel Market, Sain Vihar, Crossings Republik, Ghaziabad",,77.4342979,28.6309511
The Tasty Bakers & Confectioners,Delhi NCR,+91 9845739081 +91 9845739041,"Bakery, Fast Food",200,"Shop 07, Upper Ground Floor, Amarpali Zodiac Market, Sector 120, Near Sector 72, Noida",Cupcake,77.39921138,28.58506549
Classic Snacks,Kolkata,033 23452466,"Street Food, North Indian",150,"Old Baguihati Bazar, Baguihati Main Road, Baguihati, Kolkata",,88.42753887,22.61046026
Tobasco Kitchen,Delhi NCR,+91 9599332493 +91 9599332483,"Fast Food, Pizza",500,"U-9/1, DLF Phase 3, Gurgaon","Chicken Fries , Pasta , Chicken Pizza",77.09475014,28.49290974
Blossom Food Plaza,Kolkata,+91 9143861106 +91 8420565091,"North Indian, Chinese",350,"241/1, G.T. Road, Liluah, Howrah",Chicken Butter Masala,88.34897764,22.62017007
The Courtyard Cafe,Delhi NCR,+91 9899297999,"Chinese, Continental, North Indian",800,"Raipur Sabzimandi Market, Near Amity University, Sector 126, Near Sector 125, Noida","Pasta , Pizza , Momos , Hakka Noodles , Coffee Hazelnut , Sandwich , Chilli Mushroom",77.33398709,28.53932389
Green Pepper,Kolkata,+91 9903757836,"Chinese, North Indian",400,"21/A/2, Dewangazi Road, Belur, Howrah",,88.34796678,22.6432062
Urban Tandoor,Delhi NCR,+91 9990748999 +91 9818845647,North Indian,400,"218, Huda Market, Sector 31, Gurgaon","Paneer Tikka , Biryani , Soya Chaap Tikka , Paratha , Roti , Thali , Salad",77.0479253,28.453299
Chobdar Express,Delhi NCR,+91 7400442222,"North Indian, Fast Food",500,"G 24, LSC 3 Vardhman Star City Mall, Sector 7, Dwarka, New Delhi",,77.07192253,28.5836323
Aanya’s Amritsari Nutri Kulcha,Delhi NCR,+91 8368713542,North Indian,150,"Sector 56, Near BSNL Office, Huda Market",,77.09978331,28.42590852
Standard Ice Cream,Delhi NCR,+91 9818121651,"Desserts, Ice Cream",100,"BL Block, Shalimar Bagh, New Delhi","Kulfi Faluda , Faluda Ice Cream , Badam Milk",77.1600089,28.7106808
Foodiejuana,Delhi NCR,+91 9870169001,North Indian,400,"Shop 9/58, Gali 12, Tughlakabad Extension, Tughlakabad Institutional Area, New Delhi",,0,0
Creamy Nuts,Mumbai,+91 9619497980 +91 9619497954,"Fast Food, Beverages",350,"Shop 21, Navdurga CHS, Sector 19A, Nerul, Navi Mumbai",,73.02489091,19.02996995
Late Lateefe,Delhi NCR,011 65655758,"North Indian, Mughlai, Chinese",500,"Preet Vihar, New Delhi","Dal Makhani , Malai Chaap , Butter Chicken , Paneer Lababdar , Paneer Tikka , Maggi , Roti",77.28632558,28.63237719
Ishan Fast Food,Delhi NCR,+91 9811523532,Momos,100,"SGL Plaza, DC Chowk Sector -9, Rohini, New Delhi",,77.12564483,28.71795537
Baby Got Bacon,Delhi NCR,+91 9910891808,"American, Italian",500,"Sector 51, Noida","Cheese Bacon Fries , Peri Peri Pepperoni Pizza , Hot Dog & Bbq Bacon",77.36275211,28.57810456
Paratha's,Mumbai,022 25797923 022 40262826,North Indian,450,"196, Galleria Food Court, Galleria Shopping Centre, Hiranandani Gardens, Powai, Mumbai","Dal Makhani , Paneer Parantha , Chole , Thali , Aloo Paratha , Methi Paratha , Cheese Paratha",72.91174024,19.11957076
New Bismillah Caterers,Mumbai,+91 9167516486 +91 9167524086,"Biryani, Lebanese",350,"2, Anu Govind Sadan, Opposite DK Tower, Plot E-41, Sector 20, Airoli, Navi Mumbai","Chicken Biryani , Raita",72.98989814,19.16130555
Duke of Food,Delhi NCR,+91 9971616863,"North Indian, Chinese, Rolls",350,"D 179, Khirki Village, Malviya Nagar, New Delhi",,77.2188174,28.53080673
Kishan Cafe,Kolkata,033 22687339 +91 9830681303,Cafe,200,"178, Mahatma Gandhi Road, Bara Bazar, Kolkata",,88.35319374,22.58117966
AMA Cafe,Delhi NCR,011 66103668,"Cafe, Juices",450,"House 6, New Colony, Majnu ka Tila, New Delhi","Coffee , Pancakes , Mudcake , Pizza , Fries , Sandwich , Apple Pie",77.22841937,28.70258176
New Delhi Metro Food Plaza,Delhi NCR,+91 9599680206,North Indian,500,"Shop 1, Ajmeri Gate, Near New Delhi Metro Station Gate 3, Chawri Bazar, New Delhi",,77.22567,28.647875
Peppers & Pipes,Delhi NCR,+91 9999045133 +91 9899976175,"Chinese, Italian, Continental",600,"Shop 8, SG Complex, GU Market, Pitampura, New Delhi","Red Sauce Pasta , Chilli Potatoes , Chicken Momo , Butter Chicken",77.14524977,28.71473975
Hariram Sweets,Delhi NCR,+91 9773699246,"Mithai, Street Food",200,"Khasra 1229, Plot 216, Sant Nagar, Main Burari Chowk, Azadpur, New Delhi",,77.19906259,28.7546584
Ashoka Bar & Restaurant,Kolkata,033 22282248 033 66247925,"North Indian, Mughlai, Chinese, Seafood",900,"3B, Chowringhee Road, Near Metro Cinema, New Market Area, Kolkata",,88.35160855,22.5646286
New Royal Biryani,Kolkata,+91 9088486228 +91 9062808418,"Biryani, Mughlai",200,"153/2, Ray Bahadur Road, Behala, Kolkata",,88.32707774,22.49981669
Woods Cafe,Delhi NCR,+91 9971510554,"Cafe, North Indian, Fast Food",500,"Indira Priyadarshani Park, Arthla, Mohan Nagar, Ghaziabad","Spring Roll , Malai Chaap , Mojito , Paneer Tikka , Noodle , Raita , Mocktails",77.38829244,28.67707613
Just Coffee & More,Delhi NCR,+91 8586030189 +91 9953079205,"Cafe, Sandwich",200,"G 12, Ground Floor, Pratap Complex, Munirka, New Delhi",,77.17391487,28.55614677
Hot Spot Pizza,Delhi NCR,+91 9582825546 +91 7532918130,"Italian, Fast Food",400,"G 16, HIG, Sector 23, Sanjay Nagar, Opposite Nitra Campus, Raj Nagar, Ghaziabad",,77.45456614,28.69055207
Chacha Chaudhary Junction,Delhi NCR,+91 9650856842,Pizza,250,"154, Pocket 12, Sector 24, Rohini, New Delhi",,77.08981622,28.72975495
Hari Om Bhojanalaya,Delhi NCR,+91 8860889196 +91 9899464616,North Indian,300,"H-149, Old Gupta Colony, Opposite Kalyan Vihar, Vijay Nagar, New Delhi",Dal Makhani,77.19796054,28.69223232
AAPS 3SQUARE,Mumbai,+91 9372912343,"North Indian, Chinese",400,"Shop 15, Plot 72, Vishwa Highland, Sector 20, Kamothe, Navi Mumbai",,73.097259,19.018932
R.K. Dhaba,Delhi NCR,+91 9205124755,North Indian,300,"Arya Nagar, Sector 73, Near Sector 72, Noida",,77.38072157,28.59077245
Crunchy Street,Delhi NCR,+91 9818036575 +91 7011244247,Bakery,200,"R-80, Rajkunj, Raj Nagar, Ghaziabad","Blueberry , Mango , Strawberry",77.450286,28.67627604
Tian - Asian Cuisine Studio - ITC Maurya,Delhi NCR,011 46215152 011 26112233,"Asian, Japanese, Chinese, Thai, Momos",7000,"ITC Maurya, Chanakyapuri, New Delhi","Wine , Jasmine Rice , Prawn , Chocolate Cake , Mushroom Soup , Fish , Thai Green Curry",77.17331171,28.59796716
Khane Khas,Mumbai,022 26006970 022 26054605,"North Indian, Mughlai, Biryani, Rolls",1000,"4, Silver Croft Building, Junction Of 16th & 33rd Road, TPS 3, Pali Hill, Bandra West, Mumbai","Rolls , Butter Chicken , Tandoori Chicken , Dal Makhani , Fish Tikka , Chicken Tikka Biryani , Kadhai Paneer",72.83087298,19.06547341
36 China Town,Delhi NCR,+91 9582226554 +91 9870503863,Chinese,350,"Opposite Plot A1/22, Sector 11, Rohini, New Delhi",,77.11368553,28.73557015
The Albela's Kitchen,Kolkata,+91 9330908844 +91 9088017956,"American, Chinese, Lebanese",300,"Podrah Vivekananda Nagar Colony, Chunabhatti, Andul Road, Howrah",,88.29623502,22.56289725
J J Delicacies,Delhi NCR,+91 8586863730,"North Indian, South Indian, Fast Food",500,"52/18, Opposite Jyoti Hospital, Jharsa Road, Sector 15, Gurgaon",,77.0359521,28.4575256
